ja,ru
億劫,хлопотный
二階席は舞台から遠く、よく見えなかったのが残念,"На втором этаже место находится далеко от сцены, жаль, что я не мог хорошо видеть"
その犯罪者の悪事を白日の下に晒す日を楽しみにしてる,"Я с нетерпением жду дня, чтобы разоблачить зло преступника в свете дня"
よっぽど可愛い子じゃないと許されない,Не допускается и Defintely не милый ребенок
自分ですると手加減しちゃう,В результате в сдерживая к себе
花が花でいられる時間,Время цветы могут оставаться в цветке
照れた顔は可愛いですよね,Shy лицо не так мило
WEB明細,спецификация WEB
言いそびれちゃったけど,Я Isobire
日本で日本人がスキンヘッドをすると浮く,Поплавок и японцы кожи головы в Японии
顔出し無しの,Без внешнего вида
お水を足して、しっかり混ぜよう。,"Добавляя воду, вы Mazeyo фирмы."
あなたはストレスで太りますか？それとも痩せますか？,Вы жир в напряжении? Или вы полагаетесь?
やってないように見えて、陰でちゃんとやってるんだよ,"Похоже, что не делать, я делаю правильно в тени"
「今日はエアコンをつけていないんだよ」,«Я не ставлю кондиционер сегодня.»
長くても半日くらいが良い,Длительная и много полдня хорошо
〜の中で,~ среди
獣人,Beastman
彼女のプレーを参考にしています,Ее игра была эталону
お世話になった先生へのメッセージを貰えますか？,"Вы получаете сообщение с осторожностью, чтобы стать учителем?"
彼は部活をやめたいようだった,"Казалось, он хочет, чтобы выйти из клуба"
～な以上、それは仕方がないことだ,"~ Для больше, это то, что нет никакого способа,"
ドレス選びが面倒だからこの際みんなジャージでいいじゃん,"Ян платье выбрать хорошее в этом джерси каждого времени, потому что это громоздко"
労せずして得た物はすぐ失うものだ、,"Те получается без труда что-то потерять сразу,"
我慢して勉強する ,Для изучения и терпения
「最も近くて最も遠い国」,«Ближайший и самая дальняя страна.»
それはそれで,Именно в ней
6時間空ける,Слейте 6 часов
"1/4は貯金して,次に1/4は親にあげる","1/4 и сбережение, а затем 1/4 перечислен родитель"
今言ったことを日本語で説明して下さい,"Пожалуйста, объясните тот факт, что я сказал по-японски"
人間の体の約60%が水でできている,Около 60 процентов человеческого тела состоит из воды
良くないことが重なる日ってあるよね、,"Я думаю, что там день я перекрытие не хорошо,"
酒はともかく、タバコの量は少し減らすべきだ,"Вино в сторону, количество сигарет вы должны отрезать немного"
ポケットにスマホを入れる,Поместите смартфон в кармане
月１で法人カードの清算をする,Ликвидация корпоративной карты в месяц 1
朝起きたとき眩しいと思ったら雪が積もってた。,"Снег я думал, ослепляя, когда вы встаете утром было сложено."
デザートを食べられる分の余裕をお腹に残しておいて,Вы должны оставить минуту позволить себе съесть желудок десерт
地域力推進,Содействие региональной силы
よく聞いてるねー,Это хорошо слышно
飾らない人,"Люди, которые не декорированные"
もう地震おさまるといいけど,"Я надеюсь, что другие землетрясения универсальных"
エイヤで決めて下さい,"Пожалуйста, определяется Эйя"
昆虫食,Насекомое диета
これを楽しみに1ヶ月生きてるんです！,С нетерпением жду этого я живу один месяц!
私達は北国出身ですが寒さには全く慣れません,"Мы не привыкаем вообще в России, но холодная северная страна, родились"
私はこの土地に合うと思う,"Я думаю, что вписывается в этой земле"
AかBあたりを検討しています,Мы рассматриваем в A или B
「由々しき事態が発生しました」,«Граве ситуация произошла»
宝くじが当たったら家中の家電品を買い換えたい,Вы купили новый дом бытовых электроприборов Когда лотерейные хиты
自分が思ったこと,Это подумал он
可能性を奪ってるのと一緒,Наряду with're грабят возможность
ボールを当ててからかってきた,Он дразнил против мяча
出費多端の折,Складывание расходов другого конца
高血圧、高血糖、高脂血症、腹部肥満、,"Высокое кровяное давление, содержание сахара в крови, гиперлипидемия, абдоминальное ожирение,"
図面通りに取り付けられていない,Не прилагается к сопровождающим чертежам улице
社内システムに取引先情報を登録する,Для регистрации системы информации о клиенте в доме
自分の住んでいる場所には海が無いので海がある所が羨ましい,"Зависть это место, где есть море, потому что нет никакого моря в районе, где живут в своих собственных"
とりつくろう,Сглаживать
僕が君の立ち場だったらこの会社は辞めてるね。,Я Компания бросить курить вы Я вам поле постоянного.
鯛焼き,Taiyaki
このバスは駅と学校の間を循環してて乗り降り自由！,Эта шина свободный вход и выход циркулировали между станцией и школой!
あなたが急に退職した理由がわかりません,"Я не знаю, почему ты вдруг ушел в отставку"
マンタ,Manta
ディープな場所,Глубокое место
いや、行けないよ。,"Нет, я не пойду."
この写真を使って印刷物にして販売できますか,Вы можете продать в печатном с этой фотографией
平成時代を包括するコンセプトの展覧会です。,"Хэйсэй это выставка понятий, составляющих эпоху."
彼の誕生日パーティーで彼女に会ったことに気が付いた？,"Вы заметили, что я встретил ее на свой день рождения?"
あの星が消えた時が私の命が終わる時だ,"Это время, когда эта звезда ушла конец моей жизни"
英語が話せるようになっても何にもならない,Не что-нибудь еще так говорить по-английски
あなたは私のことを好きになるかもしれない,"Вы можете полюбить то, что я"
最近食べすぎる,переедать недавно
あ、本棚の後ろに本を落とした。めんどくさい。,"О, я выронил книгу позади книжной полки. Неудобные."
連続で予約したら嫌じゃないですか,Разве это не гадость или только вы бронируете с непрерывным
新しいパソコンの使い心地がよい,Удобно использовать хороший новый компьютер
良い行動をした,Это было хорошее поведение
流動性がある、流れてる、流通してる,"Существует ликвидность, потоки, распределяются"
「私の発音にあなたは10点満中何点つけますか?」,"«Вы помещаете то, что точка в течение 10 TenMitsuru вам мое произношение?»"
花粉症で鼻が詰まってます。すごくつらい。,Он забит нос в сенной лихорадке. Очень болезненный.
辞任,отставка
えぐみの正体は灰汁です。,Идентичность едкости является щелочью.
せっかく決めたのにそれに縛られちゃうのは本末転倒,Большие боли решили было для от привязки к нему ставить телегу впереди лошади
完納,Полная оплата
コロナにかかった人に会ったのはこれで4人目,"Я встретил человек, который взял корону теперь четвёртый"
将来の夢はまだ決まっていない,Будущая мечта еще предстоит определить
「分量は適当でいい」,«Количество хорошо уместно»
一度冷ました方が味がしみておいしい,Вкусные пятно вкус лучше охлаждаться раз
人が何か言った大切なことはしっかり書きとめてる,"Твердо отметить, что человек важен сказал, что"
一度やってみてしんどかったらすぐやめよう,Давайте не сразу Тара утомительно попробовать один раз
私の好きな動物はコアラです。,Мое любимое животное коалы.
犬が何か言いたげな顔でこちら見つめています、,"Собака здесь смотрела в то, что называется лицо Tage,"
働き手不足,Нехватка рабочих
「黒髪の女性」について,«Черные волосы женщина»
〜なら〜して,И если ~ ~
年会費を払うとビジター料金より安くなる,"Это будет дешевле, чем плата посетителей и платить ежегодный взнос"
ページが埋まりそうにない,"Это не вероятно, заполнены страницы"
人間だから良い時も悪い時もある,"Иногда даже плохо, когда хорошо, потому что человеческие существа"
「以前はちがったよね？」,"«В прошлом я думаю, что было похоже?»"
生の舞台は、夢の世界に入れる感じがとてもよい,"Сырая арена, очень хорошее чувство, чтобы поставить мечту о мире"
糖度,содержание сахара
リサイクル料金を払って、エアコンを処分した,"Оплатите рециркуляцию платы, я избавилась от кондиционера"
コロナ禍以後、通勤以外の遠出をしていない,"Корона эпидемического после, а не выхода в неперестановочном"
歯磨きは今日しなくて良い,Зубная паста не может быть сегодня
もう2度と話せないかと思った,"Я думал, что это было не больше говорить дважды"
ランニングホームラン,Запуск бежать домой
私は顔も性格も母親似です,Я лицо и личность похожа на мать
「お風呂に入った時間が遅すぎてなかなか寝れなかった」,«Купание в указанное время не было трудно спать слишком поздно.»
「そんな事ばかり言っているから、君は成長しないんだ」,"«Потому что сказать, просто такую ​​вещь, у вас не растут.»"
友達の中で、私が一番ジェットコースターに強い,"В компании друзей, я силен в лучшем горках"
少し窓を開けてもらえますか,Не могли бы вы открыть окно немного
春の訪れを感じるメニュー,Меню чувствовать приход весны
結構揺れた,Довольно сотрясение было
日本語で「～てはいけません」,«Не быть -» на японском языке
たった30分返事しなかっただけで何度も催促しないで,Не подскажите много раз просто не ответили только 30 минут
最も裕福な1%の人が全資産の48%を所有している,Богатейший 1 процент людей владеет 48 процентов от общей суммы активов
体制、体制図,"Структура, структура"
問い合わせ内容によってはお返事できないのでご了承ください,"Обратите внимание, что не может быть ваш ответ на запрос"
彼は小学校に入学してから英語を学び始めた。,Он начал изучать английский язык от входа в начальную школу.
急死,внезапная смерть
立体的なマスクだと、息が苦しくない,"Это трехмерная маска, не болезненно дыхание"
びっくりするほどの〇〇,Сто из более удивил
友達に準備を頼んだ,В ответ на просьбу подготовить другу
さんざん八つ当たりしたんだから、もう気が済んだでしょ,"Так как я был сильно ударил восемь, будет вам все равно больше уже завершена"
日本人観光客には、日本語堪能な現地人が対応してくれます,"Японские туристы, японские беглые местные жители заботятся о переписке"
途中保存中,Во время сохранения в
（恋愛意味）攻める,Атака (любовь смысл)
正直他と比べると絵は迫力にかけるが、魅力は台詞回しにある,"По сравнению с честной другой картиной подвергаются воздействию силы, но очарование в Serifumawashi"
挨拶の歌,Песня приветствия
風の谷のナウシカ,Навсикая из Долины Ветров
加工指示書,Обработка инструкций
その出来事から長い時間経過した後、私はやっと立ち直れた。,"По прошествии длительного времени от события, я, наконец, получить более."
日本の給食はただ昼食をとるだけでなく、食育も兼ねています,"Японская школа обед только обедают, а также, он также служит в качестве пищевого образования"
「人目を引くための演技」という意味のパフォーマンス,Выполнение смысла «действует для выделяющийся»
自分の国の文化などを伝えるのも大切だと思っています,"Я думаю, что также важно, чтобы сказать, и их собственная страна культура"
ボスを倒せない,Не победить босса
殻付きピーナツ,шелушится арахис
寝ても寝ても眠く感じる,Почувствуйте сонливость или спит или спит
How is the game going?の返事,Как проходит игра? Ответить
私の足は元の様には戻らない,Мои ноги не возвращаются к оригинальному способу
「社会人になりたてのうちは」,«Из свежеприготовленного для общества.»
英語を殆ど使わない,Едва ли использовать английский язык
「逆お回り」を覚えた,"Я узнал, что «обратный вокруг вас.»"
ネタバレするようなクズは死ね,"Фильера мусора, такие как интерцепторы"
アラフォーは切ないです,Arafo болезненна
お腹に優しい食べ物,Дружественные пищи в желудке
連載お疲れ様でした,Это была серия ура за хорошую работу
人狼ゲームのルール説明,Оборотень правила описания игры
やっぱりいいです、前のままでお願いします,"После того, как все хорошо, спасибо вам оставить до"
本件の対応状況は如何でしょうか？,Если соответствующий статус этого вопроса будет как?
新型コロナウイルスのワクチン接種が始まった,Вакцинация нового коронавируса началась
大事なことが書いてある紙は無くしてはならない,"Бумага не должна быть без него написано, что важно"
ネットに落ちてる,Он упал на сетку
髪をセットしてもらった,Волосы были предложены установить
チャイムが鳴る5分前,За 5 минут до утора колец
女性だからという理由でリーダーを選ぶのは釈然としない,"Выберите лидера на том основании, что, поскольку она была женщина Shakuzentoshinai"
それは問題の本質的な解決ではないと思う,"Это я думаю, что не является существенным решением проблемы"
変な音をたてながら、洗濯機が壊れた。,"Несмотря на то, что делает странный звук, стиральная машина сломана."
全部麺類ですがそれぞれ原料や特徴が違います,"Все это лапша, но немного отличается для каждого сырья и особенностей"
二重マスク,Дважды маска
明日うなぎを食べに行きます,"Я иду, чтобы поесть завтра угря"
YouTubeの24時間企画　,24 часа планирования YouTube
横にスライドしてる,Это скольжение в поперечном
その建物自体が美術品です,Само здание представляет собой произведение искусства
9月といえばお月見。 一般的に9月は月を愛でる季節,"Сентябрь Говоря просмотр Луны. Как правило, сентябрь сезон полюбоваться луной"
屋上に展望台があって素晴らしい展望が見れる。,"Прекрасный внешний вид, если есть смотровая площадка на крыше можно наблюдать."
会場に熱気がなくて盛り上がりにかける　,Это применяется к волнению без горячего воздуха на место
高校卒業せずに認定試験を受けて・・・,... В ответ на сертификационном экзамен без окончания средней школы
学校にもう連絡したよ,Это был длительный контакт школа
子供の出来,Дети могут
申し訳なさそうな表情,Апология взгляд
ご祝儀は高い,Поздравительный приз высок
少しでも意味が分からなかったり、発音が間違っていたら,"Или не знал смысла даже немного, если произношение не так"
学校の勉強大変ですががんばって下さいね,"Пожалуйста, везение, но изучает саму школу"
内閣支持率が20%台まで低下した,Кабинет уровень поддержки упал до 20 процентов
移動距離が長い,Дальние расстояния
セルビアってどんな国？,"Любая страна, которую я Сербия?"
一週間分の料理を作る,Приготовление одной недели
読者から投稿されたビデオなどを中心にまとめた本,"Книги, которые обобщают центр и видео, выложенный от читателей"
先週1回目の気管孔閉鎖術を受け、順調に回復しています。,"Поступил на прошлой неделе первой из операции закрытия трахеи отверстия, она восстанавливается постепенно."
「なんとなくこんな感じかなって、予想して答えました」,"«Интересно, как-то вроде этого, ответил ожидал»"
感染が広がりそうで、みんながしゃべっていて気になった。,"Инфекция может распространиться, все было тревожно и в чате."
キレてる老人に絡まれて追い回された,Был Oimawasa запутывается в пожилом возрасте истекло
サンプル到着後10日以内に試験を実施,Выполните проверку в течение 10 дней после прибытия образца
立場を脅かす,Угрожая положение
仕事を１５分のタスクに分ける,Разделить работу на 15 минут задачи
~~している人を街でよく見かける,"См человека, которого вы ~ ~ хорошо с городом"
仕事関連の本,Связанные с работой книги
解釈が分かれる言い方はやめよう,"Слова, интерпретация делится чтобы выйти из него"
波（潮）騒は世の常である,Wave (волна) Шум является заурядным
そうゆうお店を今まで見たことない,"Никогда не видел, так что Ю. магазин до сих пор"
(子供が友達の家の前で)「～くん、あーそーぼ！！」,"(Перед детьми дома друга) «~ кун, Asobo !!»"
お客様以上に解決意志が強くなっていた!,"Клиентов больше, чем разрешить волю стали сильнее!"
「私たちはここを離れる前にあなた達にお礼がしたい」,"«Мы хотим поблагодарить вас, ребята, прежде чем покинуть здесь.»"
せっかちな性格につきあってくれる,Я собираюсь к личности нетерпеливого
服に拘っている人を見ると,"Глядя на людей, которые участвуют в одежде"
中高６年間英語を学んだけど、英語を話した記憶がない。,"Я выучила английский средний и высокий в течение шести лет, нет памяти говорить по-английски."
子どもの時からずっと日向ぼっこが好きだった,"Это было так же, как греясь на солнце от времени ребенка"
キャンペーンをはる,Весенняя кампания
お連れ様お待ちの間、ご注文はなさいますか？,"Во время ожидания путешествующего с подобным, вы хотели бы заказать товар?"
日本語の読み書きができない方とはお取引出来ません,"Вы не можете отношения с человеком, который не может читать и писать по-японски"
普通に○○,Обычно ○○
ボトルを空にするために全部注ぎましたよ,Я вылил все бутылки в небо
そのベッド高すぎて落ちそう,"Скорее всего, падение в постели слишком высоко"
キャンセルが出た際はワクチンが無駄になってしまう。,Когда отменили из вакцины впустую.
飛行機は速いし便利だけど、準備や手続きが面倒くさい。,"Но быстро самолета, чтобы удобно, это хлопотно подготовка и процедуры."
被災しても家にいるべきか避難所に行くべきか分からない。,"Я не знаю, стоит ли идти о том, следует ли убежище быть дома, даже если бедствие."
隙間時間で暇なとき,Свободное время в промежуток времени
毛羽立つ,взбитые
